### DISCUSSION TITLE
Qobuz large files are not played to the end

### DISCUSSION THREAD

**Discussion by jdlvfr** [MusicPlayerDaemon/MPD#1806] [Q&A]
Hi all,

I noticed that the large audio files from qobuz are not played to the end. It seems that qobuz closes the connection after 2 minutes of inactivity. With MPD git I tried several values of tcp_keepalive but without success the connection is always closed after 2 minutes without effective transfer. Curl keepalive doesn't seem to help.

input {
       plugin "curl"
       #proxy "proxy.isp.com:8080"
       #proxy_user "user"
       #proxy_password "password"

        tcp_keepalive "yes"
        tcp_keepidle "30"
        tcp_keepintvl "30"
}

A tcpdump capture shows the connection closure, Reset flag received :

`08:39:46.820006 IP a96-17-206-205.deploy.static.akamaitechnologies.com.http > zordi.38968: Flags [.], seq 13052693:13054141, ack 255, win 508, options [nop,nop,TS val 3008391017 ecr 911847915], length 1448: HTTP
08:39:46.820020 IP a96-17-206-205.deploy.static.akamaitechnologies.com.http > zordi.38968: Flags [.], seq 13054141:13055589, ack 255, win 508, options [nop,nop,TS val 3008391017 ecr 911847915], length 1448: HTTP
08:39:46.820031 IP a96-17-206-205.deploy.static.akamaitechnologies.com.http > zordi.38968: Flags [P.], seq 13055589:13056983, ack 255, win 508, options [nop,nop,TS val 3008391017 ecr 911847915], length 1394: HTTP
08:39:46.855131 IP zordi.38968 > a96-17-206-205.deploy.static.akamaitechnologies.com.http: Flags [.], ack 13056983, win 0, options [nop,nop,TS val 911847963 ecr 3008391011], length 0
08:39:47.100487 IP a96-17-206-205.deploy.static.akamaitechnologies.com.http > zordi.38968: Flags [.], ack 255, win 508, options [nop,nop,TS val 3008391298 ecr 911847963], length 0
08:39:47.100494 IP zordi.38968 > a96-17-206-205.deploy.static.akamaitechnologies.com.http: Flags [.], ack 13056983, win 0, options [nop,nop,TS val 911848208 ecr 3008391011], length 0
08:39:47.572498 IP a96-17-206-205.deploy.static.akamaitechnologies.com.http > zordi.38968: Flags [.], ack 255, win 508, options [nop,nop,TS val 3008391770 ecr 911848208], length 0
08:39:48.548499 IP a96-17-206-205.deploy.static.akamaitechnologies.com.http > zordi.38968: Flags [.], ack 255, win 508, options [nop,nop,TS val 3008392746 ecr 911848208], length 0
08:39:48.548506 IP zordi.38968 > a96-17-206-205.deploy.static.akamaitechnologies.com.http: Flags [.], ack 13056983, win 0, options [nop,nop,TS val 911849656 ecr 3008391011], length 0
08:39:50.404512 IP a96-17-206-205.deploy.static.akamaitechnologies.com.http > zordi.38968: Flags [.], ack 255, win 508, options [nop,nop,TS val 3008394602 ecr 911849656], length 0
08:39:50.404523 IP zordi.38968 > a96-17-206-205.deploy.static.akamaitechnologies.com.http: Flags [.], ack 13056983, win 0, options [nop,nop,TS val 911851512 ecr 3008391011], length 0
08:39:54.116519 IP a96-17-206-205.deploy.static.akamaitechnologies.com.http > zordi.38968: Flags [.], ack 255, win 508, options [nop,nop,TS val 3008398314 ecr 911851512], length 0
08:39:54.116526 IP zordi.38968 > a96-17-206-205.deploy.static.akamaitechnologies.com.http: Flags [.], ack 13056983, win 0, options [nop,nop,TS val 911855224 ecr 3008391011], length 0
08:40:01.604526 IP a96-17-206-205.deploy.static.akamaitechnologies.com.http > zordi.38968: Flags [.], ack 255, win 508, options [nop,nop,TS val 3008405802 ecr 911855224], length 0
08:40:01.604539 IP zordi.38968 > a96-17-206-205.deploy.static.akamaitechnologies.com.http: Flags [.], ack 13056983, win 0, options [nop,nop,TS val 911862712 ecr 3008391011], length 0
08:40:16.452615 IP a96-17-206-205.deploy.static.akamaitechnologies.com.http > zordi.38968: Flags [.], ack 255, win 508, options [nop,nop,TS val 3008420650 ecr 911862712], length 0
08:40:16.452622 IP zordi.38968 > a96-17-206-205.deploy.static.akamaitechnologies.com.http: Flags [.], ack 13056983, win 0, options [nop,nop,TS val 911877560 ecr 3008391011], length 0
08:40:16.847124 IP zordi.38968 > a96-17-206-205.deploy.static.akamaitechnologies.com.http: Flags [.], ack 13056983, win 0, options [nop,nop,TS val 911877955 ecr 3008391011], length 0
08:40:16.857285 IP a96-17-206-205.deploy.static.akamaitechnologies.com.http > zordi.38968: Flags [.], ack 255, win 508, options [nop,nop,TS val 3008421055 ecr 911877560], length 0
08:40:46.148620 IP a96-17-206-205.deploy.static.akamaitechnologies.com.http > zordi.38968: Flags [.], ack 255, win 508, options [nop,nop,TS val 3008450346 ecr 911877560], length 0
08:40:46.148628 IP zordi.38968 > a96-17-206-205.deploy.static.akamaitechnologies.com.http: Flags [.], ack 13056983, win 0, options [nop,nop,TS val 911907256 ecr 3008421055], length 0
08:40:48.847133 IP zordi.38968 > a96-17-206-205.deploy.static.akamaitechnologies.com.http: Flags [.], ack 13056983, win 0, options [nop,nop,TS val 911909955 ecr 3008421055], length 0
08:40:48.857244 IP a96-17-206-205.deploy.static.akamaitechnologies.com.http > zordi.38968: Flags [.], ack 255, win 508, options [nop,nop,TS val 3008453055 ecr 911907256], length 0
08:41:19.567128 IP zordi.38968 > a96-17-206-205.deploy.static.akamaitechnologies.com.http: Flags [.], ack 13056983, win 0, options [nop,nop,TS val 911940675 ecr 3008453055], length 0
08:41:19.577318 IP a96-17-206-205.deploy.static.akamaitechnologies.com.http > zordi.38968: Flags [.], ack 255, win 508, options [nop,nop,TS val 3008483775 ecr 911907256], length 0
08:41:50.287126 IP zordi.38968 > a96-17-206-205.deploy.static.akamaitechnologies.com.http: Flags [.], ack 13056983, win 0, options [nop,nop,TS val 911971395 ecr 3008483775], length 0
08:41:50.298260 IP a96-17-206-205.deploy.static.akamaitechnologies.com.http > zordi.38968: Flags [R], seq 4285698262, win 0, length 0`

Do I miss something?
Is there anything else I can try?

Thanks
